<?xml version="1.0"?>
<!DOCTYPE tamination SYSTEM "tamination.dtd">
<!--

    Copyright 2017 Brad Christie

    This file is part of Taminations.

    Taminations is free software: you can redistribute it and/or modify
    it under the terms of the GNU Affero General Public License as published
    by the Free Software Foundation, either version 3 of the License, or
    (at your option) any later version.

    Taminations is distributed in the hope that it will be useful,
    but WITHOUT ANY WARRANTY; without even the implied warranty of
    MERCHANTABILITY or FITNESS FOR A PARTICULAR PURPOSE.  See the
    GNU Affero General Public License for more details.

    You should have received a copy of the GNU Affero General Public License
    along with Taminations.  If not, see <http://www.gnu.org/licenses/>.

-->
<tamination title="Sock It To Me">
  
  

  <tam title="Sock It To Me"
       from="Lines Facing Out"
       formation="Lines Facing Out"
       fractions="" >
    <path>
      <move select="Flip Left" beats="6" />
    </path>
    <path>
      <move select="Flip Left" beats="6" />
    </path>
    <path>
      <move select="Flip Left" beats="6" />
    </path>
    <path>
      <move select="Run Right" beats="6" scaleX="2" scaleY="3" />
    </path>
  </tam>

  <tam title="Sock It To Me"
       from="Inverted Lines"
       formation="Inverted Lines Ends Facing Out"
       fractions="" >
    <path>
      <move select="Flip Left" beats="6" />
    </path>
    <path>
      <move select="Flip Right" beats="6" />
    </path>
    <path>
      <move select="Flip Right" beats="6" />
    </path>
    <path>
      <move select="Run Right" beats="6" scaleX="2" scaleY="3" />
    </path>
  </tam>
</tamination>
