<?xml version="1.0"?>
<!DOCTYPE tamination SYSTEM "tamination.dtd">
<!--

    Copyright 2017 Brad Christie

    This file is part of Taminations.

    Taminations is free software: you can redistribute it and/or modify
    it under the terms of the GNU Affero General Public License as published
    by the Free Software Foundation, either version 3 of the License, or
    (at your option) any later version.

    Taminations is distributed in the hope that it will be useful,
    but WITHOUT ANY WARRANTY; without even the implied warranty of
    MERCHANTABILITY or FITNESS FOR A PARTICULAR PURPOSE.  See the
    GNU Affero General Public License for more details.

    You should have received a copy of the GNU Affero General Public License
    along with Taminations.  If not, see <http://www.gnu.org/licenses/>.

-->
<tamination title="1/4 Wheel the Ocean">

  <tam title="1/4 Wheel the Ocean" from="Left-Hand Two-Faced Line"
       formation="Two-Faced Line LH" parts="1.5">
    <path numbers="3 2" couples="3 1">
      <move select="BackHinge Right" />
      <move select="Stand" beats="4" hands="nohands" />
    </path>
    <path numbers="4 1" couples="3 1">
      <move select="Hinge Left" />
      <move select="Extend Left" hands="right" beats="3" scaleX="3" scaleY="2" />
      <move select="Forward" />
    </path>
  </tam>

  <tam title="1/4 Wheel the Ocean"
       from="Left-Hand Two-Faced Lines"
       formation="Two-Faced Lines LH"
       parts="1.5" >
    <path>
      <move select="Hinge Left" />
      <move select="Extend Left" hands="right" beats="3" scaleX="3" scaleY="2" />
      <move select="Forward" />
    </path>
    <path>
      <move select="BackHinge Right" />
      <move select="Stand" beats="4" hands="nohands" />
    </path>
    <path>
      <move select="BackHinge Right" />
      <move select="Stand" beats="4" hands="nohands" />
    </path>
    <path>
      <move select="Hinge Left" />
      <move select="Extend Left" hands="right" beats="3" scaleX="3" scaleY="2" />
      <move select="Forward" />
    </path>
  </tam>

  <tam title="1/4 Wheel the Ocean" from="Left-Hand Two-Faced Tidal Line"
       formation="Two-Faced Tidal Line LH" parts="1.5">
    <path>
      <move select="Hinge Left" scaleY=".5"/>
      <move select="Extend Left" hands="right" beats="2" scaleY="2" />
      <move select="Forward"/>
    </path>
    <path>
      <move select="BackHinge Right" scaleY=".5"/>
      <move select="Stand" beats="3" hands="nohands" />
    </path>
    <path>
      <move select="BackHinge Right" scaleY=".5"/>
      <move select="Stand" beats="3" hands="nohands" />
    </path>
    <path>
      <move select="Hinge Left" scaleY=".5" />
      <move select="Extend Left" hands="right" beats="2" scaleY="2" />
      <move select="Forward" />
    </path>
  </tam>

</tamination>
